Company_Brand,Sector,Stage,Funding_Year,Amount($),HeadQuarter,What_it_does,Year_Founded,Founders,Investor
Infra.Market,Real Estate,Series B,2020,20000000.0,Thane,Hella Infra Market develops an online procurement marketplace intended to serve the real estate and construction materials industry.,2016,"Aaditya Sharda, Souvik Sengupta","Trifecta Capital Advisors, Nexus Venture Partners"
Info Edge Venture,Venture capitalist,,2020,50000000.0,Noida,"Info Edge provides online recruitment, matrimonial and real estate classifieds, and related services.",1995,Sanjeev Bikhchandani,Lightbox
Clovia,E-commerce,Pre-series C,2020,4000000.0,Noida,Clovia is the online lingerie retailer,2013,"Neha Kant, Pankaj Vermani","Golden Birch Investments, She Capital"
Codingal,EdTech,Seed,2020,560000.0,Bangalore,Coding education platform for K-12 students,2020,"Satyam Baranwal, Vivek Prakash","Pras Hanuma, Rebright Partners, Java Capital, and GSF Accelerator."
CRED,Finance company,Series C,2020,80000000.0,Bangalore,CRED is a members-only app that rewards the user with exclusive rewards for paying credit card bills.,2018,Kunal Shah,"General Catalyst, Ribbit Capital"
Vistaar Finance,Finance company,,2020,30000000.0,Bangalore,The preferred full range Financial Services provider to the Small Business segment focused on rural and semi urban markets.,2010,"Brahmanad, Ramakrishna Nishtala",FMO
Let's Dive,SaaS platform,,2020,1700000.0,Bangalore,A platform for remote employee engagement and building team culture,2020,"Nitesh Agrawal, Om Prakash",Surge
Habitat,EdTech,Seed,2020,600000.0,,"Habitat, a social learning edtech platform for civil service aspirants",2016,"Rohit Pande, Shikhar Sachan","Unitus Ventures, Whiteboard Capital"
SAWO Labs,SaaS platform,Seed,2020,600000.0,Mumbai,Providing Secure Authentication solutions to Apps and Websites. Eliminating Passwords and OTPs for a seamless User Experience.,2020,Prabhat Sahu,"StartupXseed Ventures, 100X.VC"
Signzy,AI platform,,2020,3000000.0,Bangalore,Signzy are creating 'building blocks for a Digital Trust system.,2015,"Ankit Ratan, Ankur Pandey, Arpit Ratan","Stellaris Venture Partners, Mastercard"
KopyKitab,EdTech,,2020,,Bangalore,"Kopykitab is an India-based digital library that provides eBooks, and digital content in school and higher education.",2013,"Amit Shrivastava, Sumeet Verma","Paula Mariwala, Siddharth Anand"
Kyt,EdTech,,2020,2500000.0,Singapore,Holistic education for every child | Individual and small group live classes for ages 5 - 15 years,2020,"Bhavik Rathod, Tripti Ahuja",Sequoia Capital India’s Surge
Raskik,Fusion beverages,Pre-series A,2020,1000000.0,,All new fusion-flavour fruit juices with the goodness of coconut and taste of India's finest fruits.,2019,"Vikas Chawla, Abhay Parnerkar, Satyajit Ram","Venture Catalysts, 9Unicorns"
GetWork,HR Tech,Pre-seed,2020,40000.0,Gurugram,GetWork is a campus recruiting platform to post your jobs and hire across dozens of colleges at once.,2019,Rahul Veerwal,India Accelerator
Mobile Premier League (MPL),Gaming,Series B,2020,500000.0,Bangalore,Mobile Premier League is a skill-based eSports platform used to offer cash prizes while playing games.,2018,"Sai Srinivas Kiran G, Shubham Malhotra","Pegasus Tech Ventures, Base Partners"
Pravasirojgar,Job portal,,2020,33000000.0,,Initiative for blue-collar job workers,2020,Sonu Sood,GoodWorker.
Omatra Hotels,Hospitality,Seed,2020,,Kolkata,Omatra is very new hotel management firm recently registered as Omatra Hospitality Services Private Limited.,2017,"NAVEED AHAMED, SYED SAQQA ABBAS",Capify
Awign,Job portal,Pre-series B,2020,,Bangalore,Operations and manpower outsourcing startup,2016,"Annanya Sarthak, Gurpreet Singh, Praveen Sah","Unitus Ventures, Work10M"
NewsReach,Digital Media,Seed,2020,1500000.0,Gujarat,NewsReach India offers partner publications a digital footprint and monetisation of their content via advertisements.,2018,"Darshan Shah, Soniya Kundnani","Mumbai Angels, JITO Angel Network."
Cashfree,FinTech,Series B,2020,35000000.0,Bangalore,Cashfree is a payments and banking technology company that enables businesses in India to collect payments online and make payouts.,2015,"Akash Sinha, Reeju Datta","George Osborne, Smilegate Investment"
Credgenics,FinTech,Pre-series A,2020,3000000.0,New Delhi,"Credgenics is a tech-enabled platform backed by Titan Capital, helping fintech lenders and Banks in their critical NPA reduction",2018,"Anand Agrawal, Mayank Khera, Rishabh Goel","Accel India, Breadlake Ventures"
GeoIQ,AI startup,Seed,2020,300000.0,Bangalore,"Map-based intelligent platform with single-click access to street-level location data - demographics, competitions, movements - for retail.",2018,"Devashish Fuloria, Tusheet Shrivastava, Ankita Thakur","Ankur Mittal, Mitesh Shah"
Country Delight,Dairy startup,Series C,2020,25000000.0,Haryana,Country Delight produces and distributes milk intended to provide good quality and unadulterated milk at doorstep.,2015,"Chakradhar Gade, Nitin Kaushal","IIFL Asset Management, Matrix Partners"
Quintype,Content management,Series A,2020,3500000.0,Bangalore,"A technology company that focus on building a suite of digital publishing solutions to simplify content creation, distribution, audience engagement",2014,Chirdeep Shetty,IIFL AMC
CARS24,Retail,Series E,2020,200000000.0,Haryana,CARS24 is an India-based platform for selling used cars.,2015,"Mehul Agrawal, Ruchit Agarwal, Vikram Chopra","Global Car Group, Freemark holdings"
Astrogate Labs,Spacetech,,2020,,Bangalore,Astrogate Labs provides high-quality products related to space infrastructure.,2017,,"Venture Catalysts, Speciale Invest"
Power Gummies,HealthTech,Bridge,2020,,New Delhi,Power Gummies are a team of passionate givers who are dedicated to catering nutritional supplements,2018,Divij Bajaj,Venture Catalysts
Cityflo,Transportation,Series A,2020,7000000.0,Mumbai,Cityflo is an urban transportation app that provides comfortable and economical buses for daily commute.,2015,"Advaith Vishwanath, Ankit Agrawal, Jerin Venad, Rushabh Shah, Sankalp Kelshikar, Subhash Sundaravadivelu","Anupam Mittal, India Quotient"
AlgoBulls,Trading platform,,2020,200000.0,Mumbai,Algobulls is a state-of-the-art Trading Platform where customers are provided with Fully Automated Algorithmic Trading,2019,"Pushpak Dagade, Jimmit Patel and Suraj Bathija",Venture Catalysts
Credgenics,FinTech,Pre-series A,2020,3000000.0,Gurugram,"Credgenics is a tech-enabled platform backed by Titan Capital, helping fintech lenders and Banks in their critical NPA reduction",2018,"Anand Agrawal, Mayank Khera, Rishabh Goel","Accel India, Breadlake Ventures"
Inntot,Tech company,,2020,,Kerala,"Inntot Technologies, is a technology driven company.",2014,Rajith Nair,Unicorn India Ventures
Ensuredit,FinTech,Pre-series A,2020,300000.0,Gurugram,ENSUREDIT enables and empowers end customers and Insurance Intermediaries with AI-based product platforms for transformational customer experience.,2019,"Amit, Rohit Sadhu, and Vikas Ranga",Venture Catalysts
Shipsy,AI Company,Series A,2020,6000000.0,Gurugram,Shipsy's platform enables data driven decision making enhancing visibility and operational efficiency for Supply Chain industry,2015,"Dhruv Agrawal, Himanshu Gupta, Soham Chokshi","DTDC, Udaan Angel Partners"
ERPNext,Tech company,,2020,1000000.0,Mumbai,"ERPNext is an Open Source, Online ERP solution which includes Accounting, CRM, Inventory, Purchasing, HR, Support and a lot more.",2008,Rushabh Mehta,Rainmatter
LightSpeedAI,Photonics startup,,2020,,Bangalore,Developer of an optoelectronic processor designed to accelerate AI computations.,2019,"Rohin Y, PV Ramana","YourNest, growX ventures"
Grip Invest,FinTech,Pre-series A,2020,,Gurugram,Grip is an investment platform that allows retail investors to make small ticket investments in physical assets that earn lease income.,2020,"Nikhil Aggarwal, Vivek Gulati",Gemba Capital
Unacademy,EdTech,,2020,,Bangalore,Unacademy is an online learning platform providing educational content such as video lectures and examinations.,2015,"Gaurav Munjal, Hemesh Singh, Roman Saini, Sachin Gupta","Dragoneer Investment Group, Tiger Global Management"
Yellow Classes,EdTech,Pre-series A,2020,1300000.0,Gurugram,New-age fun-learning platform for kids.,2020,"Arpit Mittal, Anshul Gupta",India Quotient
Plum,HealthTech,,2020,4100000.0,Bangalore,High quality health insurance and health benefits,2019,"Abhishek Poddar, Saurabh Arora","Surge, Tanglin Venture Partners"
STAGE,Entertainment,,2020,1000000.0,Indore,STAGE is an Indian language content platform for artist-led entertainment.,2019,"Shashank Vaishnav, Vinay Singhal, Parveen Singhal",Venture Catalysts
Nykaa,Cosmetics,,2020,,Mumbai,Nykaa is an online marketplace for different beauty and wellness products.,2012,Falguni Nayar,"Alia Bhatt, Katrina Kaif"
Kaagaz Scanner,Scanning app,,2020,575000.0,,Kaagaz Scanner is the Indian replacement to banned Cam Scanner App.,2020,"Snehanshu Gandhi, Gaurav Shrishrimal",Pravega Ventures
NIRA,FinTech,,2020,1000000.0,Bangalore,"NIRA promotes financial inclusion by creating simple, transparent products that empower individuals to live a life of choice and freedom.",2017,"Rohit Sen, Nupur Gupta","Techstars Bangalore Accelerator, Techstars"
Prolixr,Skincare startup,Seed,2020,,Gurugram,A premium skincare brand committed towards building innovative skin care wellness.,2018,"Aditya Sharma, Jayesh Hans","Alfa Ventures, Divij Bajaj"
Byju's,EdTech,,2020,200000000.0,Bangalore,BYJU'S is an educational technology company that develops personalized learning programs for K-12 students.,2011,"Byju Raveendran, Divya Gokulnath","Owl Ventures, Tiger Global Management"
DaMENSCH,E-commerce,,2020,6000000.0,Bangalore,DaMENSCH is a designer and seller of men's apparel.,2018,"Anurag Saboo, Gaurav Pushkar","Whiteboard Capital, Matrix Partners India"
Country Delight,Food and Beverages,Series C,2020,25000000.0,Haryana,Country Delight produces and distributes milk intended to provide good quality and unadulterated milk at doorstep.,2015,"Chakradhar Gade, Nitin Kaushal","Orios Venture Partners, Matrix Partners India"
SignalX,AI startup,Seed,2020,800000.0,Hyderabad,SignalX offers an artificial intelligence-powered SaaS platform,2018,"Govind Balachandran, Zakir Wahab, Piyush Arora","9Unicorns, 3Lines VC, Hyderabad Angels"
Lancify,EdTech,,2020,300000.0,Bangalore,Lancify is building the world's strongest young workforce,2018,"Gowtham Sundaresan, Azan Barodawala","Techstars, Techstars Bangalore Accelerator"
Krimanshi,Biotechnology company,Seed,2020,600000.0,Jodhpur,Krimanshi aims to increase rural income by improving the productivity of Indian cattle with better quality feed.,2015,Nikhil Bohra,"Rajasthan Venture Capital Fund, AIM Smart City"
Instoried,AI startup,Pre-series A,2020,1000000.0,Bangalore,Instoried is an augmented writing platform which improves customer interest and engagement.,2018,"Sharmin Ali, Sutanshu Raj","Venture Catalysts, SOSV"
PlayerzPot,Gaming startup,Series A,2020,3000000.0,Mumbai,"Favorite fantasy cricket, football & kabaddi leagues online to win daily cash and prizes",2015,"Yogesh, Mitesh Gangar",
Instamojo,FinTech,,2020,,Bangalore,"Instamojo is an on-demand payments platform that enables entrepreneurs to build, manage, and grow their business online.",2012,"Aditya Sengupta, Akash Gehani, Harshad Sharma, Sampad Swain","BASE, Gunosy Capital"
Turtlemint,HealthTech,,2020,30000000.0,Mumbai,Turtlemint has built Indian personalized insurance platform,2015,"Anand Prabhudesai, Dhirendra Mahyavanshi, Kunal Shah","Nexus Venture Partners, Dream Incubator"
Arata,E-commerce,Pre-series A,2020,1000000.0,New Delhi,Arata is an e-commerce site for beauty products and cosmetics.,2017,"Dhruv Madhok, Dhruv Bhasin",DSG Consumer Partners
MPL,Gaming startup,,2020,5000000.0,Bangalore,Mobile Premier League is a skill-based eSports platform used to offer cash prizes while playing games.,2018,"Sai Srinivas Kiran G, Shubham Malhotra","Pegasus Tech Ventures, Base Partners"
True Balance,FinTech,,2020,28000000.0,Gurugram,True Balance is a digital wallet that enables users to access utility bill payment and other financial products.,2014,"Cheolwon Lee, Jay Yi, Martin Lee","IBK Capital, SB Partners"
Thrive,FoodTech,Pre-series A,2020,,Mumbai,"Thrive is all-in-one restaurant ordering suite for table ordering, pickup, and delivery with marketing in-built.",2020,"Dhruv Dewan, Krishi Fagwani","Whiteboard Capital, Ahimsa Capital"
Kitchens Centre,Proptech,Pre-series A,2020,,New Delhi,Kitchens Centre offers turnkey solutions to cloud kitchens.,2019,Lakshay Jain,"Jonathan Swanson, Ankush Gera"
Prescribe,HealthTech,,2020,100000.0,Chennai,Provide online services to patients by leveraging WhatsApp.,2019,Nived Narayanan,Titan Capital
Nepra,CleanTech,Series C,2020,18000000.0,Ahmedabad,NEPRA Resource Management provides waste management solutions in India.,2006,Sandeep Patel,"Asha Impact, Aavishkaar Venture Capital"
inFeedo,SaaS startup,,2020,3200000.0,Gurugram,"inFeedo is a predictive people analytics company helping 300,000+ employees in 100+ companies make their voice feel heard and valued.",2013,Tanmaya Jain,"Peyush Bansal, Ritesh Malik"
Shilpa Sciences,HealthTech,Pre-series A,2020,,Bangalore,Shilps Sciences is a healthtech platform that claims to have solved gene editing by accelerating single gene cell applications.,2014,Ashwin Lal,AngelList India
Arzooo,Tech Startup,,2020,,Bangalore,"B2B retail tech platform transforming 300,000+ SMEs in electronics space with its flagship ""Go Store"" product",2016,"Khushnud Khan, Rishi Raj Rathore","3Lines, Jabbar Internet Group"
MindTickle,SaaS platform,Debt,2020,100000000.0,Pune,MindTickle offers the industry's most comprehensive sales readiness solution for closing knowledge and skill gaps in customer-facing teams.,2011,"Deepak Diwakar, Krishna Depura, Mohit Garg, Nishant Mungali","Canaan Partners, NewView Capital"
Slice,FinTech,Debt,2020,5000000.0,Bangalore,Slice is a card for first-time credit card users. They are inventing the future of finance for young Indians,2016,"Deepak Malhotra, Rajan Bajaj","Better Capital, Gunosy"
Rapawalk,E-commerce,Seed,2020,300000.0,Bangalore,Rapawalk is an online brand that offers a personalized service of creating your own shoes.,2017,"Kashif Mohammad, Aravind Maddireddy","Sanjay Ramakrishnan, Ravi Garikipati"
Oga Fit's,Fitness startup,Pre-series A,2020,,Bangalore,The new-age home workout app that gives you an unmatched boutique digital fitness studio experience.,2017,Ashish Rawat,9Unicorns
LAVAL,Cosmetics,Pre-series A,2020,,Bangalore,"Laval Cosmetics, affordable makeup for all ages",2016,"Shrishti, Prithika",Jazal Group
Stride Ventures,Venture capitalist,,2020,80000000.0,New Delhi,Stride Ventures is a venture capital firm in India which aims to invest in innovative startups across the country.,2019,Ishpreet Gandhi,Small Industries Development Bank of India
BlackSoil,FinTech,,2020,10000000.0,Mumbai,Blacksoil Advisory is an independent boutique advisory firm.,2016,Ankur Bansal,
Biocon,Healthcare,,2020,15000000.0,Bangalore,"Biocon is a healthcare and technology, company focused on biotechnology.",1978,Kiran Mazumdar-Shaw,Goldman Sachs
Clientjoy,SaaS startup,Pre-series A,2020,800000.0,Gujarat,Client Management Software For Modern Agencies.,2013,"Abhishek Doshi, Anupama Panchal, Shashwat Bhatt, Yash Shah","LetsVenture, Jyotsna Bapat"
Xpressbees,E-commerce,,2020,100000000.0,Pune,Xpressbees is an e-commerce logistics company that provides reliable logistics solutions to its partners.,2015,"Amitava Saha, Supam Maheshwari","Alibaba Group, InnoVen Capital"
GalaxyCard,FinTech,Seed,2020,,Gurugram,Mobile based Instant credit card. | Easiest way to get a credit card. Get one in 3 minutes,2017,"Amit Kumar, Gunjeet Singh",India Accelerator
Wellness Forever,HealthTech,,2020,100000000.0,Mumbai,Wellness Forever is the one-stop destination for wellness,2008,"Ashraf Biran, Gulshan Bakhtiani, Mohan Chavan","Poonawalla, Allana Group"
MoooFarm,AgriTech,Pre-seed,2020,500000.0,Gurugram,MoooFarm is an information technology company that bridges the technology gap to help marginalized dairy farmers.,2019,"Param Singh, Aashna Singh, Abhijeet Mittal, Jitesh Arora","Navus Ventures, Rockstart"
BitClass,PaaS startup,Seed,2020,2000000.0,Bangalore,BitClass is a PaaS solution which helps teachers set up their independent live classes,2020,"Gunjan Kejriwal, Utsav Tiwary","AET Japan, Figure Eight Investments, Waterbridge Ventures"
Gonuts,Entertainment,Seed,2020,400000.0,Mumbai,Personalised Video shoutouts from favourite celebrity.,2020,"Vinamra Pandiya, Mayank Gupta, Joji George","Sweta Rau, Archana Priyadarshini"
Uolo,EdTech,Seed,2020,2000000.0,Bangalore,Uolo Technology is founded by paranoid parents who want to make a difference to preschool experience.,2013,"Pallav Pandey, Ankur Pandey, Siddharth Singh","Rajul Garg, Purvi Capital"
Kirana King,Retail,Pre-series A,2020,900000.0,"Jaipur, Rajastan","A revolutionary idea of standardization, digitization & centralization to traditional Grocery system.",2014,Anup Kumar,Rajasthan Venture Capital Fund
Jade Forest,Beverages,Seed,2020,250000.0,Delhi,"NATURALLY THE BEST From zero artificial ingredients in our drinks to the way they make you feel, we bring you a bespoke range of natural mixers.",,"Punweet Singh, Shuchir Suri",
iKure,HealthTech,,2020,,Kolkata,iKure is a social enterprise that delivers primary healthcare and wellness & prevention services to communities in India,2010,Sujay Santra,"Ratan Tata, Inflection Point Ventures, Ankur Mittal"
FrontRow,EdTech,Seed,2020,3200000.0,Bangalore,"Comprehensive courses, taught by idols.",,"Mikhil Raj, Shubhadit Sharma, Ishaan Preet Singh","Lightspeed, Elevation, Deepika Padukone"
Reliance Retail,E-commerce,,2020,10000000.0,Mumbai,Reliance Retail Ventures Limited is a subsidiary company of Reliance Industries Limited.,2006,Mukesh Ambani,"Abu Dhabi Investment Authority, GIC"
TUBBR,Social Media,,2020,,"Frisco, Texas, United States",World's First Personal Social Network,2019,"Saurabh Uttam, Ravi Singhal",Global Ascent Partners
Ather Energy,Automobiles,Series D,2020,35000000.0,Bangalore,Ather Energy is a manufacturer of electric scooters.,2013,"Arun Vinayak, Swapnil Jain, Tarun Mehta",HeroMotoCorp Ltd and Sachin Bansal
Routematic,SaaS startup,,2020,2000000.0,Bangalore,Vision is to enable a safer and more comfortable commute to work for employees of India Inc.,2007,"Sriram Kannan, Surajit Das","VAMM Ventures, Naresh Malhotra"
LivFin,FinTech,,2020,4700000.0,New Delhi,LivFin is a non-banking financial company registered with the Reserve Bank of India (RBI),2017,Rakesh Malhotra,"DEG, KFW DEG"
Universal Sportsbiz Pvt Ltd,Fashion startup,,2020,,Bangalore,A fashion startup based in Bengaluru.,2012,Anjana Reddy,"Accel, Alteria Capital"
Lattu Kids,EdTech,,2020,,Mumbai,Lattu kids is an edutainment platform for preschool kids.,2017,Vivek Bhutyani,Mumbai Angels Network
Eggoz,Food & Bevarages,Pre-series A,2020,1500000.0,Indore,"Eggoz is a brand of fresh and chemical-free eggs, produced in tech-enabled & nutrition-engineered deep integration partnership with farmers.",2016,"Abhishek Negi, Aditya Singh, Pankaj Pandey, Uttam Kumar","AVANA Capital, Rebright Partners"
Steradian Semiconductors,Deeptech,,2020,,Bangalore,Semiconductor company focused on CMOS millimeter wave products for Radar.,2016,"Gireesh Rajendran, Ashish Lachhwani, Apu Sivadas, Rakesh Kumar and Alok Joshi",Endiya Partners.
CHARGE+ZONE,EV startup,Pre-series A,2020,3000000.0,Gujarat,"Charge+Zone provides services in renewable energy solutions, product development, and software engineering company.",2018,"Kartikey Hariyani, Pavan Bakeri",Mumbai Angels
Stones2milestones,EdTech,Bridge,2020,2000000.0,Gurugram,Stones2milestones is India (Delhi) Based EdTech Company,2008,"Kavish Gadia, Nikhil Saraf","Menterra Venture Advisors, Emandi Sankara Rao"
Udacity,EdTech,Debt,2020,75000000.0,California,"Udacity develops an online learning platform offering programs in artificial intelligence, machine learning, and robotics sector.",2011,"David Stavens, Mike Sokolsky, Sebastian Thrun","Hercules Capital, Inc.Bertelsmann"
AjnaLens,AR/VR startup,Bridge,2020,1000000.0,Thane,"AjnaLens develops AR/VR wearables primarily for the Defence, Education and enterprise customers.",2014,"Abhijit Patil, Abhishek Tomar, Pankaj Raut","Mohsin Hani Al Bahrani, MoD"
Gully Network,E-commerce,Pre-series A,2020,1200000.0,Bangalore,Gully Network is a tech-enabled network of mid-sized grocery stores.,2019,"Ajay Nain, Prateek Chaturvedi","CP Ventures, Orios Venture Partners"
TurboHire,Recruitment startup,Seed,2020,1000000.0,Hyderabad,Talent Intelligence Platform for enterprises that helps recruiters discover the right candidates for a job using a Human-like AI,2018,"Abhishek Kabra, Aman Gour","Kia Ora Ventures, Pentathlon Ventures"
Traya,HealthTech,Seed,2020,,Mumbai,work with our customers closely to get their hair health sorted for long-term effective results,,"Altaf Saiyed, Saloni Anand","Kae Capital, Whiteboard Capital"
Charcoal Eats,QSR startup,,2020,2000000.0,Mumbai,"In the last five years, have served over 1.5 million orders and enjoy high customer satisfaction.",2015,"Anurag Mehrotra, Krishnakant Thakur, Mohammed Bhol, Gautam Singh",Lokmat Investments
Mitron TV,Video platform,,2020,,Bangalore,Mitron is a free short videoplatform for next generation,2020,"Shivank Agarwal, Anish Khandelwal",9Unicorns
Svami,Food & Bevarages,,2020,800000.0,Mumbai,Svami is the result of three seasoned drinkers extending their love for libations to the larger world of drinks.,2016,Sahil Jatana,"Niren Shah, Rukam Capital Trust"
Dhurnia,EdTech,,2020,100000.0,"Dhingsara, Haryana",Developer of an online learning platform intended for various competitive exam preparations.,2018,"Ajay Kumar, Murari Singh","Chandigarh Angels Network, Modulor Capital"
Expertrons,EdTech,,2020,,Mumbai,Expertrons is an AI video bot platform created to help students and professionals prepare for interviews.,2019,Jatin Solanki,"Rohit Chanana, Sukanta Ganguly"
Leena AI,AI startup,,2020,8000000.0,"New York, United States",Leena AI offers a human resource management platform that transforms employee experience with conversational AI.,2015,"Adit Jain, Anand Prajapati, Mayank Goyal","Alan Patricof, Jim Moffatt"
Bizlog,Logistics,,2020,1000000.0,Bangalore,Bizlog Value Chain enables re-commerce and circular economy through unique REVERSE LOGISTICS engine.,2016,"HS Srinivasan, Krishnan Rajan, E.V. Shunmugam",IAN Fund
Tamasha.live,Gaming,,2020,300000.0,Mumbai,"Tamasha offers a platform for influencers to host live, video based, real money contests and games.",2020,"Saurabh Gupta, Siddharth Swarnkar","9Unicorns, Titan Capital, FirstCheque"
Fedo,AI startup,,2020,1000000.0,Bangalore,Artificial Intelligence based Credit Score for Health,2017,"Arun Mallavarapu, Prasanth Madavana",AIM Smart City
FabHotels,Hospitality,,2020,1000000.0,Gurugram,Fabhotels is the online aggregator for hotel rooms. It aims to provide standardized services at economical budgets.,2015,"Adarsh Manpuria, Vaibhav Aggarwal","RB Investments Pte. Ltd, Goldman Sachs"
Freshokartz,AgriTech,Pre-series A,2020,1000000.0,"Jaipur, Rajastan","Freshokartz provides soil data based crop and fertilisers recommendation to farmers and delivery seeds, pesticides",2016,"Chandrakanta, Rajendra Lora","Rajasthan Venture Capital Fund, Innovana Thinklabs"
FlexiLoans,FinTech,Debt,2020,6000000.0,Mumbai,"an online lending platform started with an endeavour to solve the problem that SMEs face in accessing Quick, Flexible and Adequate funds for growing their Businesses.",2016,"Abhishek Kothari, Deepak Jain, Manish Lunia, Ritesh Jain",>Vikram Sud
Agrix,AgriTech,,2020,,Patna,"Farming-as-a-service (covering farm machinery and agri input services) and provides market linkages, especially for fragmented farm owners.",2020,"Nilay Pandey, Saurav Singh, Vivek Kumar",Maple Capital Advisors
BharatAgri,AgriTech,Pre-series A,2020,,Pune,A Smart Farming Technology Platform for Indian Farmers,2017,"Siddharth Dialani, Sai Gole","021 Capital, India Quotient"
FreshtoHome,E-commerce,Series C,2020,121000000.0,Bangalore,Freshtohome is an e-commerce platform for fresh and chemical-free seafood.,2015,Shan Kadavil,"Ascent Capital, Iron Pillar"
Credable,FinTech,,2020,4500000.0,Mumbai,CredAble provides working capital & supply chain finance programs for large enterprises and their suppliers and distributors.,2017,Nirav Choksi,Oaks Asset Management
Railofy,Transportation,Seed,2020,5000000.0,Mumbai,Railofy is a WL & RAC protection that enables waitlisted passengers to reach their destination at the lowest possible price.,2019,"Rohan Dedhia, Vaibhav Saraf, Hrishabh Sanghvi","Roots Ventures, Better Capital"
Finova Capital,FinTech,,2020,55000000.0,"Jaipur, Rajastan",Finova Capital is a non-banking financial company.,2016,"Mohit Sahney, Sunita Sahney","Sequoia Capital India, Faering Capital"
Teachmint,Edtech,Seed,2020,3500000.0,Bangalore,Teachmint is an easy to use platform for tutors to conduct unlimited live classes and manage their classrooms,2020,"Mihir, Payoj Jain, Divyansh Bordia, Anshuman Kumar",Lightspeed India
Peel-Works,E-commerce,,2020,3000000.0,Mumbai,Peel-Works is a tech and data analytics company specializing in e-commerce for corner stores.,2010,"Sachin Chhabra, Nidhi Ramachandran","CESC Ventures, Brun Raschle"
Janani,Fertility tech,Pre-seed,2020,200000.0,Bangalore,Janani aims to make the process of infertility treatment and assisted fertilisation easier,2020,Nilay Mehrotra,9Unicorns
Credgenics,FinTech,Seed,2020,3300000.0,Gurugram,"Credgenics is a tech-enabled platform backed by Titan Capital, helping fintech lenders and Banks in their critical NPA reduction",2018,"Anand Agrawal, Mayank Khera, Rishabh Goel","Accel, Sunder Nookala"
Finelistings,Luxury car startup,,2020,,New Delhi,A Used Luxury Car Marketplace,2015,Aneesh Mathur,Justdial
