Company_Brand,Sector,Stage,Funding_Year,Amount($),HeadQuarter,What_it_does,Year_Founded,Founders,Investor
Pariksha,Edtech,Pre series A,2020,,Pune,Platform for vernacular test-preparation,2015,"Karanvir Singh, Utkarsh Bagri, Vikram Shekhawat, Deepak Choudhary","INSEAD Angels, IIT Kanpur Angels, Sixth Sense Ventures, Saahil Bhatia"
DailyHunt,Media,,2020,24000000.0,,News aggregator,,Virendra Gupta,"Bytedance, Falcon Edge, Goldman Sachs, Advent Management"
NoBroker,Real Estate,,2020,30000000.0,Bangalore,Online real estate rental startup,2014,"Amit Kumar Agarwal, Akhil Gupta, Saurabh Garg",General Atlantic
Box8,Foodtech,,2020,4000000.0,Mumbai,Enables to order food online,2011,"Amit Raj, Anshul Gupta","IIFL Seed Ventures Fund, Menlo park"
Capital Float,Fintech,,2020,15000000.0,Bangalore,Online platform that provides working capital finance to SMEs,2013,"Gaurav Hinduja, Sashank Rishyasringa","Ribbit Capital, SAIF Partners, Sequoia Capital India, Amazon"
ITILITE,Travel & SaaS,Series B,2020,13000000.0,Bangalore,Platform for business travel,,"Mayank Kukreja, Anish Khadiya","Greenoaks Capital, Vy Capital. Matrix Partners India"
Morning Context,Digital Media,Seed Round,2020,,,A subscription-only digital media publisher,,,Angel investors
Aavenir,SaaS,Seed Round,2020,2000000.0,Ahmedabad,Source-to-Pay Software,2019,Ashish Bhandari,Accel
Savvy Co op,Healthcare,,2020,,,It connects patients with healthcare companies,,Jen Horonjeff,Indie VC
BLive,Tourism & EV,Pre series A,2020,,,"It offers experiential, guided tours on smart electric bikes",2018,"Samarth Kholkar, Sandeep Mukherjee",Mumbai Angels Network
Yellow Messenger,AI,Series B,2020,20000000.0,Bangalore,It offers conversational chatbots,,Raghavendra Kumar Ravinutala,"Lightspeed Venture Partners, Lightspeed India Partners."
Toch,Media Tech,,2020,400000.0,,AI based Video object detection and Tagging platform,,"Vinayak Shrivastav, Saket Dandotia, Alok Patil",Inflection Point Ventures
Ewar,Gaming,,2020,200000.0,Bangalore,E-sports and real-time gaming startup,,"Parth Chadha, Rahul Singh","Jindal Steels, Jeet Banerjee"
Setu,Fintech,Series A,2020,14259000.0,,"Offers open APIs across four categories: bills, savings, credit, and payments.",,"Sahil Kini, Nikhil Kumar","Lightspeed Venture, Falcon Edge, Bharat Inclusive Technologies Seed Fund."
Wellthy Therapeutics,Healthtech,Pre series A,2020,4000000.0,Bangalore,It offers a digital therapeutics service,,Abhishek Shah,Saama Capital
Power Gummies,Health,,2020,,Delhi,Offers health supplements related gummies,2018,Divij Bajaj,Venture Catalysts
Locale ai,Location Analytics,,2020,,Bangalore,It helps companies with moving assets  increase revenues and demand using real time location data and analytics,2019,"Rishabh Jain, Aditi Sinha",Better Capital
FarEye,Logistics,Series D,2020,24500000.0,Delhi,"It enables businesses to execute, track, predict and oprimize the movements of goods",,"Gaurav Srivastava, Gautam Kumar, Kushal Nahata","M12, Honeywell venture capital, Eight Roads Venture"
Rebel Foods,Food tech,,2020,50000000.0,,It runs internet kitchen,,"Jaydeep Barman, Kallol Bannerjee",Coatue Management
BankBazaar,Fintech,Series D,2020,3800000.0,Chennai,Online marketplace that gives customers instant customised offers on loans and credit cards,2008,"Adhil Shetty, Arjun Shetty, Rati Shetty,","Amazon, Sequoia, Walden SKT Venture Fund"
Porter,Logistics,Series D,2020,18370000.0,Mumbai,Logistics and fleet management,2014,"Pranav Goel, Uttam Digga",Lightstone Global Funds
SugarBox,Tech,,2020,68525000.0,Mumbai,Hyperlocal data distribution platform,,Rohit Paranjpe,Zee Entertainment Enterprises Limited
Capital Float,Fintech,Series F,2020,4800000.0,Bangalore,Online platform that provides working capital finance to SMEs,2013,"Gaurav Hinduja, Sashank Rishyasringa","Amazon Inc`, Dinesh J Hinduja"
Big Basket,E store,,2020,60000000.0,Bangalore,Online grocery store,,"Abhinay Choudhari, Hari Menon, Vipul Parekh, VS Sudhakar",Alibaba Holdings
Amica,Fintech,,2020,2000000.0,,Neobanking startup,,Jitendra Gupta,"Hummingbird Ventures, Bedrock Capital"
Vedantu,Edtech,Series C,2020,12500000.0,Bangalore,Onine learning platform,,"Saurabh Saxena, Pulkit Jain, Anand Prakash, Vamsi Krishna",Legend Capital
Fingerlix,Food,,2020,1834000.0,,"It provides ready-to-cook products such as batters, mixes, curries, dals, parathas etc.,",2016,"Shrikrishna Bharambe, Shripad Nadkarni, Varun Khanna, Abhijit Berde","Accel, Zephyr Peacock, Swiggy, RB Investments."
Plop,Tech,Angel Round,2020,,Mumbai,It Provides an interactive fiction entertainment platform to entertain & educate Gen Z & Millennials in a language they understand,,"Vineet Shetty, Anushka Shetty","Better Capital, LetsVenture, Rohit Chanana, Jayant Kadambi, Sunil Kumar Singhvi"
Zupee,Gaming,Series A,2020,8000000.0,,It runs live quiz tournaments on its app.,2018,"Malhi, Siddhant Saurabh",Matrix Partners
DeHaat,Agritech,Series A,2020,12000000.0,,Online marketplace for farming services and products,2012,Shashank Kumar,Sequoia Capital India
Lido Learning,Edtech,Series B,2020,7500000.0,Mumbai,Online teaching service,,Sahil Sheth,Bace Capital
Aye Finance,Fintech,,2020,23850000.0,Gurugram,A finance lender to SMEs,2014,"Vikram Jetley, Sanjay Sharma",Undisclosed
Swiggy,Foodtech,Series A,2020,43000000.0,Bangalore,Platform to order food online from restaurants and getting it delievered,2014,"Nandan Reddy, Sriharsha Majety, Rahul Jaimini","Tencent, Ark Impact, Korea Investment Partners, Samsung Ventures, Mirae Asset Capital Markets"
Akna Medical,Healthtech,,2020,7000000.0,,Provides supply solutions for surgical and pharmaceutical products.,2018,"Saurabh Pandey, Mahadevan Narayanamoni",LGT Lightstone Aspada
Zomato,Foodtech,,2020,5000000.0,Gurugram,Online food delivery and restaurant discovery platform,,Deepinder Goyal,Pacific Horizon
RaRa Delivery,Logistics,Seed Round,2020,800000.0,,Provides same day delivery service for ecommerce businesses,,Karan Bhardwaj,"Der Shing Lim, 500 startups"
JusPay,Fintech,Series B,2020,21600000.0,Bangalore,Online payment solutions,,Vimal Kumar,Vostok Emerging Finance
Obviously AI,Data Science,,2020,,,It provides predictive insights to clients by leveraging their data,2018,"Tapojit Debnath, Nirman Dave",Arka Venture Labs
Fingpay,Fintech,Series A,2020,3500000.0,Mumbai,Provides payment solutions,2016,"Pratyush Halen, Anuraag Agrawal",IvyCap Ventures
Recko,SaaS,Series A,2020,6000000.0,Bangalore,The platform enables AI-powered reconciliation of digital transactions,2017,"Prashant Border, Saurya Prakash Sinha",Vertex Ventures
Furlenco,Ecommerce,,2020,10000000.0,Bangalore,Furniture rental startup,2012,Ajith Mohan Karimpana,"Chowdry Associates, Lightbox"
Mera Cashier,Fintech,,2020,150000.0,Noida,App meant for small and micro businessmen to manage their transactions digitally,2019,"Suneel Kumar, Gaurav Tomar, Sucharita Redd","Sukhbir Singh, India Accelerator, Boudhik Ventures, Shankar Nath, Shaurya Garg"
Kitchens Centre,,Seed Round,2020,500000.0,Delhi,Offers solutions to cloud kitchens by providing commercial space and kitchen infrastructure to assisting with branding and other services,2019,Lakshay Jain,AngelList India
Camp K12,Edtech,Seed Round,2020,4000000.0,Gurugram,It connects students with tutors online,,"Anshul Bhagi, Sandeep Bhagi","Matrix Partners, SAIF Partners"
MedGenome,Healthtech,Series D,2020,55000000.0,Bangalore,Genetic diagnostic testing company,2013,Sam Santhosh,LeapFrog Investments
Ergos,Agritech,,2020,4598000.0,Bangalore,It enables farmers to digitise their foodgrain and also provide access to supply chain solutions,,"Kishor Jha, Praveen Kumar",Aavishkar Capital
Nykaa,Ecommerce,,2020,13137000.0,Mumbai,Deals in cosmetic and wellness products,2012,Falguni Nayar,Steadview capital
Samadhan,Insurance,Seed Round,2020,,Delhi,They help find solutions to insurance related issues,2018,"Deepak Bhuvneshwari Uniyal, Shilpa Arora, Shailesh Kumar, Sanjay Aggarwal",Venture Catalysts
SaScan,Healthcare,,2020,,Bangalore,Cancer diagnostics startup,,Subhash Narayanan,Unicorn India ventures
Lido Learning,Edtech,,2020,3000000.0,Mumbai,Online teaching service,,Sahil Sheth,"Pecus Capital, Madhur Deora"
CureFit,Health and Fitness,Series D,2020,115000000.0,Bangalore,"Integrated platform for food, fitness and meditation.",2016,"Mukesh Bansal, Ankit Nagori",Temasek
Nimesa,SaaS,,2020,,Bangalore,Cloud data managemnt solutions enterprise,2018,"Tapesh Goyal, Rajesh Vaidhyanathan",Ideaspring capital
Design X,IoT,Seed Round,2020,200000.0,Noida,Builds IoT based products,,Preet Arjun Singh,ThinkNext LLC
Driftly Electric,Automobile,,2020,,Bangalore,Electric vehicle startup,,Sneha Roy,MG Motor India
Imstrong,Fitness,Seed Round,2020,400000.0,Bangalore,It is an online and live video-streaming platform that allows trainers and fitness enthusiasts to connect and engage in interactive online classes.,2019,"Dilip Kumar, Selvan Thamarai, Deepti Nair",Rainmatter
Craftsvilla,Marketplace,,2020,3900000.0,Mumbai,Online marketplace for ethnic wear,,Monica Gupta. Manoj Gupta,Supera Investments
Rupifi,Fintech,Pre seed round,2020,,Bangalore,Offers financial products for SMEs,2020,"Anubhav Jain, Ankit Singh, Jawaid Iqbal","Ashneer Grover, Kunal Shah, Ramakant Sharma"
SnackAmor,Food,Seed Round,2020,,Mumbai,It offers various healthy snacks,,Deepak Grover,Undisclosed
Zealthy,Healthtech,Seed Round,2020,,Bangalore,"It connects women to healthproviders for specialities like infertility, maternity etc.,",2019,"Rishi Malhotra, Akhil Gupta","KYT Ventures, First Cheque, AngelList"
CoinDCX,Fintech,Series A,2020,3000000.0,,A cryptocurrency trading platform,,Sumit Gupta,"Polychain Capital, Bain Capital Ventures, HDR Group"
NuNu TV,Media,,2020,670000.0,,Kids-focussed Youtube channel,,,Risers Accelerators
QTalk,Technology,Seed Round,2020,1600000.0,Bangalore,Smart Phone Dialer,,"Sagar Modi, Advaith Vishwanath","Accel India, Lightspeed Venture Partners"
Shadez,Interior & decor,Seed Round,2020,100000.0,Mumbai,Paint Company,2018,"Adarsh Anand, Amit Tiwari",Inflection Point Ventures
Excess2Sell,Ecommerce,,2020,1000000.0,Mumbai,B2B Marketplace for Overstock & Surplus Inventory,,Rajan Sharma,Gautham Madhavan
Stanplus,Healthtech,Pre series A,2020,1500000.0,Hyderabad,Ambulance service,2016,Prabhdeep Singh,Pegasus FinInvest
Pitstop,Automobile,Series A,2020,2500000.0,Bangalore,Doorstep car service,,Mihir Mohan mishra,TPG-backed Group Landmark
Univariety,Edtech,,2020,1100000.0,Hyderabad,Online marketplace that provides career counselling and college guidance,2015,Jaideep Gupta,Info Edge
Peel Works,SaaS,"Series C, D",2020,,Mumbai,E-commerce for corner/retail stores.,2010,"Sachin Chhabra, Nidhi Ramachandran",CESC Ventures
CoreStack,Technology,Series A,2020,8500000.0,Chennai,Enterprise cloud governance technology startup,2016,"Ezhilarasan Natarajan, Sabapathy Arumugam, Krishnakumar Narayanan, Thiruvalluvar NB",Naya Ventures
Vivriti Capital,Fintech,Series B,2020,50000000.0,Chennai,Digital lending startup,2017,"Gaurav Kumar, Vineet Sukumar",LGT Lightstone Aspada
Agnikul,Spacetech,Pre series A,2020,3148000.0,Chennai,"It designs, fabricates, tests and launch orbital class launch vehicles",,Srinath Ravichandran,pi Ventures
Fintso,Fintech,,2020,2600000.0,,Wealth management platform,2020,"George Mitra, Rajan Pathak","Rajeev Juneja, Pratul Shroff, Dilip Khandelwal, Piyush Gupta"
Khatabook,Fintech,,2020,,Bangalore,It helps SMEs to maintain their accounts and ledger online.,,Ravish Naresh,Mahendra Singh Dhoni
Smart Coin,Fintech,Series A,2020,7000000.0,,Consumer lending startup,2015,"Amit Chandel, Rohit Garg, Vinay Kumar, Jayant Upadhyay",LGT LightstoneAspada
ZunRoof,Cleantech,Series A,2020,3000000.0,Gurugram,"It specialises in solar rooftop design, installation, and management using technology",2016,"Pranesh Chaudhary, Sushant Sachan",Godrej Investments
Shop101,Social e-commerce,Series C,2020,3900000.0,,Enables entrepreneurs to sell online,2015,"Abhinav Jain, Aditya Gupta","Stellaris Venture Partners, Unilever Ventures, Kalaari Capital, Vy Capital"
OM Bhakti,FMCG,Seed Round,2020,,Bangalore,A puja cotton-wicks manufacturing startup,,"Sridhar Joshi, Prashant Kulkarni",Venture Catalysts
Lal10,B2B,,2020,1100000.0,Uttar Pradesh,It helps Indian artisans and SMEs reach out to global retailers,2016,"Maneet Gohil, Sanchit Govil, Albin Jose",Sorenson Impact
Anaxee Digital Runner,Tech,,2020,,Indore,A tech-enabled ID verification and data collection startup,2016,"Govind Agrawal, Arti Agrawal",Orios Venture Partners
CollegeKhabri,Edtech,,2020,,Bhopal,Platform is an end-to-end college and career counselling platform for students,2019,Arshi Khan,Vishal Dixit
Ola Electric,eMobility,,2020,1000000.0,Bangalore,Electric vehicle,,"Ankit Jain, Anand Shah",Pawan Munjal Family Trust Fund
Multi Living,Real Estate,,2020,6000000.0,Mumbai,"It curates apartments from the homeowners, performs the quality check and offers the homes with built-in services to the potential tenants",,Pankaj Singh,Lodha Ventures
FamPay,Fintech,Seed Round,2020,4700000.0,Bangalore,"It allows parents to send money to their kids below the age of 18, which they can spend securely under parent supervision.",,Kush Taneja,"Y Combinator, Venture Highway, Sequoia India, Global Founders Capital"
UnboxRobotics Labs,Automation tech,Seed Round,2020,500000.0,Bangalore,Automated flexible parcel sorting solutions for logistics providers,,Pramod Ghadge,"Arali Ventures, CIIE.CO"
Karbon Card,Fintech,Seed Round,2020,2000000.0,Bangalore,Specialisde corporate cards for startups,,"Pei-fu Hsieh, Amit Jangir","Kunal Shah, Amrish Rau, Jitendra Gupta"
Airmeet,Media & Networking,,2020,3000000.0,Bangalore,"A platform to host, discover, and attend fully remote events like conferences and professional meet-ups",,"Lalit Mangal, Vinay Jaasti, Manoj Singh",Accel India
Innerchef,Foodtech,,2020,1000000.0,Gurgaon,Cloud kitchen platform,,Rajesh,Mistletoe
Epigamia,FMCG,Series C,2020,,Mumbai,Flavoured and greek yoghurt brand,2015,Rohan Mirchandani,KA Enterprise
StyleNook,Ecommerce,,2020,,Mumbai,Marketplace for fashionable apparel,,Lathika Pai,"Lead Angels Network, Stanford Angels"
Callido Learning,Edtech,,2020,,Mumbai,Provides a structured educational approach to critical thinking and problem solving skills,,Sriram Subramanian,Education Catalyst Fund
Soxytoes,Ecommerce,,2020,,Delhi,Online store to buy various types of socks including funky and colorful socks,,"Vidushi Kajaria, Aayush Goenka",Angel network
F5,E-market,Seed Round,2020,,Delhi,Retail Aggregator,2018,"Raghav Arora, Lalit Kumar Aggarwal",LetsVenture investors
Paper Boat,Food & Beverages,,2020,4049500.0,Bangalore,Ecommerce platform for beverages and snacks,2013,"Neeraj Kakkar, James Nutall, Suhas Misra, Neeraj Biyani","Advent Management, A91 Emerging Fund, Trifecta Venture"
Strata,Proptech,Seed Round,2020,1500000.0,Bangalore,Real estate investment platform,2019,"Sudarshan Lodha, Priyanka Rathore","SAIF Partners, Mayfield India"
Salesken,AI & Data science,Series A,2020,8000000.0,Bangalore,Provides sales professionals with intelligence on various aspects of the sales pitch,,"Sreeraman Vaidyanathan, Surga Thilakan",Sequoia India
Arya,Agritech,Series B,2020,6000000.0,Noida,Provides post-harvest services across the agricultural value chain,,Prasanna Rao,LGT Lightstone Aspada
Leap Finance,Fintech,,2020,5500000.0,Bangalore,Provides education loans to students based on the student’s future income,,"Vaibhav Singh, Arnav Kumar",Sequoia India
Sleepy Owl,Beverages,,2020,,Delhi,"It sells ready to drink cold brew coffees, brew boxes and packs.",2016,"Ajai Thandi, Arman Sood, Ashwajeet Singh",Rukam Capital
Tricog,Healthtech,Series B,2020,10500000.0,Bangalore,Provides virtual cardiology services through its AI-powered healthcare platforms,2015,"Charit Bhograj, Zainul Charbiwala, Udayan Dasgupta, Abhinav Gujjar","UTEC-The University of Tokyo Edge Capital, Aflac Ventures, LLC, Dream Incubator, TeamFund"
GogoBus,Travel tech,,2020,,Delhi,Inter-City Mobility Startup,,Amit Gupta,Ixigo
Trell,Social e-commerce,Pre series A,2020,4000000.0,Bangalore,Allows users to share their travel experiences,2016,"Pulkit Agrawal, Prashant Sachan, Arun Lodhi, Bimal Kartheek Rebba, Nirav Sheth","Sequoia’s Surge, Fosun RZ"
Spaciya Consultants,Real Estate,Pre series A,2020,500000.0,Noida,Real estate consultancy firms,,Ajit Panda,Alok Garg
Bounce,Automotive and Rentals,,2020,6500000.0,Bangalore,Offers a variety of bikes and scooters that can be rented on a subscription basis,2014,"Vivekananda Hallekere, Anil Giri Raju, Arun Agni",InnoVen Capital
Neeman,Ecommerce,Pre series A,2020,1000000.0,,An eco-conscious footwear brand making comfortable shoes using Merino Wool,2017,"Taran Chhabra, Amar Preet Singh",Anicut Angel Fund
Chqbook,Fintech,Series A,2020,5000000.0,Gurugram,"Marketplace for small business owners, offering them products around lending, credit cards etc",2017,"Vipul Sharma, Rajat Kumar, Sachin Arora, Mohit Goel",Aavishkaar Capital
SMEcorner,Fintech,Series B,2020,30000000.0,Mumbai,Financial lending firm to SMEs,2014,"Bhatia, Sneha Shah",Paragon Partners
Oda Class,Edtech,Pre series A,2020,,Bangalore,"It offers content and material via video, adopting a dual-teacher model with IIT and NIT alumni",,"Li Yong, Shushant Srivastava",Yuanfudao
Spinny,E-tail,Series B,2020,43700000.0,Haryana,Used car retailing platform,2015,"Niraj Singh, Mohit Gupta, Ramanshu Mahuar","Nandan Nilekani, Sanjeev Aggarwal"
goStops,Accomodation,,2020,,Delhi,A premium chain of youth hostels catering to the millennials,2012,"Pallavi Agarwal, Pankaj Parwanda",Atraxn Partners.
Umeed Housing,Fintech,Series D,2020,23000000.0,Haryana,Housing finance company,,Ashutosh Sharma,Morgan Stanley Private Equity Asia
Vogo,Automotive,Series C,2020,20000000.0,Bangalore,A scooter-sharing platform allowing users to rent a two-wheeler from specific designated pick up points,2016,"Anand Ayyadurai, Padmanabhan Balakrishnan, Sanchit Mittal",Lightstone Aspada
Flick Stree,AI & Media,Series A,2020,3000000.0,Mumbai,Artificial intelligence-based video publishing network,,Saurabh Singh,Samsung Venture Investment
Qure ai,Healthtech,,2020,16000000.0,Mumbai,Provides interpretations of radiology scans,2016,"Prashant Warier, Pooja Rao",Sequoia India
MinionLabs,Machine Learning,,2020,,Bangalore,It leverages a Machine Learning-based approach to generate a comprehensive report on predictive analytics,,Gokul Shrinivas,Indian Angel Network
Josh Talks,Media,Pre series A,2020,1500000.0,Haryana,Community of young individuals providing a platform to showcase their stories,2015,"Supriya Paul, Shobhit Banga",Media Development Investment Fund
PhoneParLoan,Fintech,,2020,,Delhi,Provides easy loans,2015,Ringaile Noq,Accelerator MOX
RailYatri,Travel,,2020,13800000.0,Noida,A complete Indian railways app,2011,"Manish Rathi, Kapil Raizada, Sachin Saxena","Nandan Nilekani, Samsung Venture Investment Corporation"
AjnaLens,Deeptech,Pre series A,2020,1500000.0,Thane,"It leverages technologies such as AR, VR & AI to offer hardware in areas such as education and defence",2014,"Pankaj Raut, Abhishek Tomar, Abhijit Patil","Maharashtra Defence, Aerospace Venture Fund (MDAVF)"
Pepper,Content Marktplace,Seed funding,2020,306900.0,Mumbai,End to end content creation platform,2017,Anirudh Singla and Rishabh Shekhar,"Kunal Bahl, Rohit Bansal"
Rupeek,Fintech,,2020,30000000.0,Bangalore,An asset backed online lending platform,2015,"Amar Prabhu, Ashwin Soni, Sumit Maniyar","GGV Capital, Bertelsmann India Investments, Binny Bansal, Sequoia India, Accel Partners"
iMerit,IT,Series B,2020,20000000.0,Kolkata,Turns information into data that is usable for machine learning processes,2012,Radha Basu,CDC Group Plc
BharatPe,Fintech,Series C,2020,75000000.0,Delhi,Digital payments platform,2018,Ashneer Grover,Ribbit Capital
Invideo,Visual Media,,2020,2500000.0,,Video production and editing platform,,Sanket Shah,Sequoia Capital’s Surge
AvalonMeta,Edtech,,2020,420000.0,,It combines higher education and competitive gaming,2017,"Varun Mayya, Shashank Udupa, Abhinav Arora",Peerplays
Near Store,Ecommerce,Seed Round,2020,300000.0,Mumbai,Enables a shop to create an online presence,,,Sauce.vc
ElecTorq,Automobile,,2020,,Delhi,Electric vehicle startup,,Anubhav Sharma,AdvantEdge
Prayaan Capital,Fintech,Seed Round,2020,1200000.0,Chennai,"NBFC that lends to micro, small, and medium-sized enterprises (MSMEs)",,"Madhan Mohan , Akash Chelvam",Accion Venture Lab
Sanfe,Hygiene,Pre series A,2020,1100000.0,Delhi,Women health care and wellness product,,"Archit Agarwal, Harry Sehrawat","SucSEED Venture Partners, BIRAC, Elixir Pharma, Titan Capital"
Go Desi,Foodtech,Seed Round,2020,627300.0,Delhi,Provides traditional delicacies,2018,Vinay Kothari,Rukam Capital
Swiggy,Foodtech,Series A,2020,113000000.0,Bangalore,Platform to order food online from restaurants and getting it delievered,2014,"Nandan Reddy, Sriharsha Majety, Rahul Jaimini",Prosus N.V
Whatfix,SaaS,Series C,2020,32000000.0,Banglore,"Digital adoption platform that helps companies provide intuitive onboarding, training and support",2014,"Khadim Batti, Vara Kumar",Sequoia Capital India
Unacademy,Edtech,Series E,2020,110000000.0,Bangalore,Platform that offers online education in India,2010,"Gaurav Munjal, Roman Saini, Hemesh Singh","Facebook, General Atlantic, Sequoia India, Nexus Venture Partners, Steadview Capital, Blume Ventures"
Zvesta,Proptech,,2020,5500000.0,Gurugram,An online platform where users can search and buy properties listed by developers and brokers,2015,"Rajan Dang, Anushree Srivastava",Hindustan Media Ventures
Dunzo,Logistics,,2020,11000000.0,Bangalore,India-based hyperlocal delivery startup,2014,Kabeer Biswas,Alteria Capital
Digit Insurance,Insurtech,,2020,340000.0,Bangalore,General Insurance Company,,Kamesh Goyal,"Virat Kohli, Anushka Sharma"
Yolo,Transport,Seed funding,2020,600000.0,Gurugram,Intercity transportation,2019,"Shailesh Gupta, Mukul Shah, Danish Chopra",Undisclosed
SmartVizX,VR & SaaS,Pre series A,2020,1397000.0,,It developed India’s first VR-based design communication and collaboration product Trezi,2015,"Tithi Tewari, Gautam Tewari",Rockstud Capital
MaxWholesale,Ecommerce,Series A,2020,3000000.0,Delhi,B2B ecommerce platform for kirana stores,2016,Samarth Agrawal,"IAN Fund-I,  Al Falaj Investment Company (AFI)"
Carbon Clean,Cleantech,,2020,16000000.0,,Develops affordable carbon capture technology,2009,"Aniruddha Sharma, Prateek Bumb","WAVE Equity Partners, Chevron Technology Ventures, Marubeni Corporation."
Onsitego,Sales & Services,Series B,2020,19000000.0,,It offers post-purchase services through a network of brand authorised service centres throughout the country,,Mahipal,Zodius Growth Fund
Genius Corner,Edtech,,2020,250000.0,Noida,Framework to enable personalised learning using artificial intelligence (AI) and machine learning (ML).,2014,"Vishal Khatter, Dheeraj Khatter, Dipak Varshney","Mahesh Mohta, Jyoti Arora, Nachu Subramanian, Srivats"
PlanetSpark,Edtech,,2020,448500.0,Gurugram,Provides neighbourhood learning zones where children learn and develop 'new-age' skills under one roof,2016,"Maneesh Dhooper, Kunal Malik","Indian Angel Network, Lead Angels, Hyderabad Angels"
CamCom,AI & Deep learning,,2020,,Bangalore,AI automation platform for enterprise quality control,2017,"Ajith Nayar, Umesh, Mahesh Subramanian","Triton Investment Advisors,"
Simsim,Social Commerce,Series B,2020,8000000.0,Bangalore,It enables community opinion influencers to sell products to thousands of micro-communities in India,,Amit Bagaria,"Accel Partners, Shunwei Capital, Good Capital"
Shuttl,Transport,Series C,2020,7975700.0,Delhi,App based bus aggregator serice,2015,"Amit Singh, Deepanshu Malviya",SIG Global India Fund
HooLiv,Housing & Rentals,,2020,,Delhi,Student Co-living startup,,"Chinmoy Mishra, Gaurav Vij, and Abhishek Verma",Kolte-Patil Family Office
ClassMonitor,Edtech,,2020,,Indore,The learning platform that blends curriculum-based activities for children,,"Vijeet Pandey, Vikas Rishishwar",Ashwin Khorana
Friyey,Co-working,,2020,,Pune,Co working space startup,,Yogesh Thore,Tarun Bhalla
Oga,Fitness,,2020,330000.0,Bangalore,Provides interactive fitness experience to people across the world,,Ashish Rawat,Inflection Point Ventures
Big Basket,Estore,,2020,3500000.0,Bangalore,Online grocery store,,"Abhinay Choudhari, Hari Menon, Vipul Parekh, VS Sudhakar",Trifecta Capital
CYFIRMA,SaaS,Series A,2020,,Bangalore,Offer cybersecurity services,,Ritesh Kumar,Z3 Partners
Innoviti,,,2020,5000000.0,Bangalore,Digital payments solutions company,,Rajeev Agrawal,FMO
Paytm money,Fintech,,2020,5600000.0,Bangalore,Wealth Management,2010,Vijay Shekhar Sharma,One97 Communications
Vedantu,Edtech,Series C,2020,24000000.0,Bangalore,Onine learning platform,,"Saurabh Saxena, Pulkit Jain, Anand Prakash, Vamsi Krishna",GGV Capital
Yap,Fintech,,2020,1402000.0,Chennai,Banking and payment products-focused API platform,,"Madhusudanan R, Muthukumar and Prabhu","Amrish Rau, Kunal Shah, Jitendra Gupta"
Clover,Agritech,Series A,2020,5500000.0,Bangalore,Provides agricultural solution to farmers working in the greenhouse production of vegetables and fruits,,"Avinash BR, Gururaj Rao, Arvind Murali, Santhosh Narasipura","Omnivore, Accel Partners, Mayfield"
Nova Credit,Fintech,Series B,2020,50000000.0,,Cross-border consumer credit startup,,Nicky Goulimis,"Kleiner Perkins, Canapi Ventures, Index Ventures, Nyca Partners, General Catalyst."
CodingNinjas,Edtech,Series A,2020,5200000.0,Delhi,Online learning platform,2016,"Singla, Kannu Mittal, Dhawal Parate",Info Edge Ltd
Furlenco,Ecommerce,Series C,2020,2200000.0,Bangalore,Furniture rental startup,2011,Ajith Mohan Karimpana,Chowdry Associates
Brick&Bolt,,Pre series A,2020,1500000.0,Bangalore,Operates in the residential construction space,2018,"Jayesh Rajpurohit, Arpit Rajpurohit",Surge
HempStreet,Healthtech,Pre series A,2020,1000000.0,,Manufacturer of ayurvedic medicines based on cannabis,2019,Abhishek Mohan,Pharmacon Holdings
