Company_Brand,Sector,Stage,Funding_Year,Amount($),HeadQuarter,What_it_does,Year_Founded,Founders,Investor
CareerNinja,EdTech,Seed,2021,0.0,Mumbai,"Careerninja Is A Funded, Early-stage Ed-tech Venture Building A Personalized Learning Platform To Help People Achieve Their Career Goals",2017,Shronit Ladhaniai,Unitus Ventures
MYSUN,Solar,Unknown,2021,2000000.0,New Delhi,"India's Largest Online Rooftop Solar Platform for SMEs, Industries & Homes",2016,Gagan Vermani,TATA Cleantech Capital
Sea6 Energy,Biotechnology,Series B,2021,9000000.0,Bangalore,"Sea6 Energy envisions a future where the abundant oceans will be our biomass farms of tomorrow - to provide solutions in energy, agriculture and food.",2010,"Sailaja Nori, Nelson Vadassery, Sowmya Balendiran, Shrikumar Suryanarayan",Aqua-Spark
Beco,Consumer Goods,Seed,2021,500000.0,Mumbai,"Eco-friendly home and kitchen care products that are plastic-free, high in quality and affordable.",2018,"Aditya Ruia, Akshay Varma, Anuj Ruia",Climate Angels Fund
OneCode,Internet,Unknown,2021,5000000.0,Bangalore,"OneCode is a platform which connects new age digital first brands with ""relevant"" sellers (aka OneCoders) to sell their products and services",2020,"Manish Shara, Yash Desai","Sequoia’s Surge, Nexus Venture Partners"
MedPay,Information Technology,Seed,2021,1200000.0,Bangalore,MedPay® is building the real-time claims adjudication platform for health insurers.,2020,"Arun Bhatia, Ravi Chandra","Entrepreneur First (EF), GrowX Ventures"
Inshorts,Internet,Unknown,2021,60000000.0,Noida,Built Inshorts with a promise to deliver news,2013,Azhar Iqubal,Vy Capital
Digantara,SpaceTech,Seed,2021,2500000.0,Bangalore,"Digantara is an Indian Space Technology Company incubated at Indian Institute of Science (IISc), establishing a space-based surveillance platform with global realtime earth coverage",2018,"Anirudh N Sharma, Rahul Rawat, Tanveer Ahmed",Kalaari Capital
Aqgromalin,AgriTech,Seed,2021,700000.0,Chennai,Aqgormalin is a tech driven farm diversification platform enabling farmers to diversify into Animal Husbandry and Aquaculture.,2018,"Prasanna Manogaran, Bharani CL",Zephyr Peacock
Square Yards,Real Estate,Unknown,2021,25000000.0,Gurugram,India’s largest tech enabled Real Estate Brokerage and Mortgage Marketplace,2014,Tanuj Shori,ADM Capital
OYO,Hospitality,Unknown,2021,660000000.0,Gurugram,OYO is a global platform that empowers entrepreneurs and small businesses with hotels and homes by providing full-stack technology,2013,Ritesh Agarwal,"SoftBank Vision Fund, Hindustan Media Venture"
Slang Labs,Computer software,Unknown,2021,0.0,Bangalore,Slang Labs provides accurate and multilingual in-app voice assistants for Android and web apps,2017,Kumar Rangarajan,100x Entrepreneurs
NirogGyan,Healthcare,Seed,2021,0.0,Gurugram,"Simplifying Diagnostics for labs, doctors, and people.",2019,"Joyneel Acharya, Shweta Gandhi","Healthcare veterans, PIEDS"
Ola Electric,Automotive,Debt,2021,100000000.0,Bangalore,Ola Electric - The future of mobility is here.? Charging ahead to accelerate the world’s transition to sustainable mobility.,2017,Bhavish Aggarwal,Bank of Baroda
Bikry app,Consumer software,Unknown,2021,1300000.0,Noida,"Bikry, a Direct-to-Customer platform to start your online store within 30 seconds at 0% commission",2019,Abhishek Bhayana,YCombinator
Oliveboard,EdTech,Unknown,2021,3000000.0,Bangalore,Oliveboard is the top exam preparation platform for Banking & Government Exams.,2012,"Abhishek Patil, V Satish Kumar",IAN Fund
Little Leap,EdTech,Unknown,2021,300000.0,New Delhi,Soft Skills that make Smart Leaders,2020,Holistic Development Programs for children in age range 5-15,"ah! Ventures, Vishal Gupta"
Trell,Social commerce,Series B,2021,45000000.0,Bangalore,India's Largest Lifestyle Social Commerce platform. Empowering millions of storytellers & Micro-Entrepreneurs.,2016,"Pulkit Agarwal, Prashant Sachan, Arun Lodhi, Bimal Kartheek Rebba","Mirae Asset, H&M"
Kredent,EdTech,Unknown,2021,1000000.0,Kolkata,Kredent Academy is the unique concept where financial market professionals have taken the onus of creating a strong knowledge bank in their area of expertise,2008,"Vineet Patawari, Vivek Bajaj, Vinay Pagaria",Kotak Securities
EasyAspataal,Healthcare,Seed,2021,500000.0,Mumbai,India’s First Digital Admission Desk for Hospitalisation.,2020,"Manoj Gupta, Gunjali Kothari",Venture Catalysts
SMOOR,Food & Beverages,Unknown,2021,0.0,Bangalore,Instigate your sixth sense with our new range of chocolates.,2008,Vimal Sharma,Klub
Pankhuri,Social community,Unknown,2021,3200000.0,Bangalore,"Pankhuri is a women's only community for members to socialize, explore and upskill through live interactive courses, expert chat and interest-based clubs.",2019,Pankhuri Shrivastava,Sequoia’s Surge
Arcana,Information Technology,Seed,2021,370000.0,Bangalore,Arcana is the Storage Layer of Ethereum.,2019,"Mayur Relekar, Aravindh Kumar, Abhishek Chaudhary",Balaji Srinivasan
AdmitKard,EdTech,Pre-series A,2021,1000000.0,Noida,A tech solution for end to end career advisory to students looking to study abroad.,2016,"Vamsi Krishna, Pulkit Jain, Gaurav Munjal	#REF!",Unknown
UrbanKisaan,Food & Beverages,Unknown,2021,0.0,Hyderabad,A modern farms close to where your home is. Creating positive change at every step from seed to store ensuring quality and traceability.,2017,"Srinivas Chaganti, Vihari Kanukollu, Sairam Reddy",BASF Venture Capital GmbH
Aquaconnect,Fishery,Pre-series A,2021,4000000.0,Chennai,Aquaconnect is a global full-stack aquaculture technology venture that provides data-driven farm advisory and marketplace solutions to fish and shrimp farmers,2017,Rajamanohar,"Rebright Partners, Flourish Ventures"
Vah Vah!,EdTech,Unknown,2021,1800000.0,Bangalore,A mission to educate India and make its young and dynamic population job ready.,2020,"Shailesh Daxini, Akash Senapaty, Muthukaleeshwaran Subbiah",Sequoia Surge
LetsDressUp,Apparel & Fashion,Pre-series A,2021,300000.0,Gurugram,Building India's version of Stitch Fix,2019,Aditya B,"Titan Capital, Sequoia Capital"
Sapio Analytics,Computer software,Unknown,2021,150000.0,Mumbai,Aim to provide the most intelligent AI-powered policy making solutions for government institutions across the world.,2019,"Ashwin Srivastava, Hardik Somani, Prashant Nikam",Parthiv Group
BHyve,Human Resources,Unknown,2021,300000.0,Mumbai,A Future of Work Platform for diffusing Employee Tacit Knowledge and enabling Peer Learning Networks,2020,Backed by 100x.VC,"ITO Angel Network, LetsVenture, Omkar Pandharkame, Ketaki Ogale"
Indi Energy,Renewables & Environment,Seed,2021,0.0,Roorkee,"Indi Energy is an energy storage startup involved in R&D of next generation battery technologies, with superior performance than current counterparts.",2019,Dr. ASIT SAHOO,Mumbai Angels Network
The Ayurveda Co,Consumer Goods,Unknown,2021,0.0,Gurugram,The Ayurveda Co. represents things that are all Ayurvedic at heart and are suited for the contemporary landscape.,2021,"Param Bhargava, Shreedha Singh","GetVantage, Velocity, Shiprocket Capital"
Pratilipi,Online storytelling,Unknown,2021,48000000.0,Bangalore,"Pratilipi is the largest Indian language self-publishing platform with over 350,000 authors and more than 28,000,000 unique monthly readers.",2015,Ranjeet Pratap Singh,"Krafton Inc, Omidyar"
Ati Motors,Automotive,Pre-series A,2021,35000000.0,Bangalore,Autonomous industrial vehicle maker,2017,"Saurabh Chandra, Saad Nasser","Blume Ventures, Exfinity Venture Partners"
peAR,Deeptech,Pre-series A1,2021,300000.0,Mumbai,An AR / VR tech based Start-up in Mumbai.,2018,"Dharmin Vora, Dhruvesh Mehta, Parth Vora",Inflection Point Ventures
Gourmet Garden,Farming,Unknown,2021,3000000.0,Bangalore,"100% contamination free, pesticide free naturoponically grown vegetables.",2019,Arjun Balaji,"Beyond Next Ventures, M Venture Partners"
The Sleep Company,Consumer Goods,Pre-series A,2021,1000000.0,Mumbai,Patent Pending sleep technology developed by actual Rocket Scientists and sleep experts after years of research.,2019,,Fireside Ventures
TyrePlex,B2B E-commerce,Seed,2021,0.0,New Delhi,Tyreplex is digitizing the tyre dealers in India.,2020,"Puneet Bhaskar, Rupendra Pratap Singh",AdvantEdge Founders
ION Energy,Automotive,Pre-series A,2021,3600000.0,Mumbai,Advanced Electronics & Software Supplier for Electric Vehicles & Battery Energy Storage,2016,Akhil Aryan,
Digit Insurance,Insuretech,Unknown,2021,200000000.0,Bangalore,"Digit becomes the first Unicorn of 2021, valued at $1.9B.",2016,Kamesh Goyal,"Faering Capital, Sequoia Capital India, IIFL Alternate Asset Managers"
FRAAZO,Food & Beverages,Series A,2021,11000000.0,Mumbai,FRAAZO is Mumbai's favourite App for Fresh Vegetables and Fruits coming straight from the Farm to your Doorstep within 18 Hours.,2020,"Atul Kumar, Aashish Krishnatre","Sixth Sense Ventures, NABVENTURES"
Licious,Food & Beverages,Series F,2021,192000000.0,Bangalore,"Licious is a consumer food company, focussed at delighting the world with an unmatched range of meat & meat products.",2015,"Abhay Hanjura, Vivek Gupta","Temasek, Multiples PE"
WinZO,Gaming,Series C,2021,65000000.0,New Delhi,WinZO is the largest social gaming and entertainment platform in India.,2018,Paavan Nanda,Griffin Gaming Partners
Furlenco,Consumer Goods,Unknown,2021,100000000.0,Bangalore,Furlenco is a different furniture company.,2012,Ajith Mohan Karimpana,Zinnia Global
Skylark Drones,Aviation,Pre-series A,2021,3000000.0,Bangalore,"Enterprise drone solutions that help plan, build, and sustain the world we live in.",2014,Mughilan Thiru Ramasamy,"InfoEdge Ventures, IAN Fund"
Leegality,IT company,Pre-series A,2021,0.0,Gurugram,"The market standard for eSign, eStamp and Document Workflow in India. Eliminating paper from paperwork since 2016",2016,Shivam Singla,"IIFL, Mumbai Angels"
Arcatron Mobility,Healthcare,Unknown,2021,0.0,Pune,Mission is to advance global standards of assisted living and make it dignified and safer.,2015,Ganesh Sonawane,Klub
TWID,FinTech,Unknown,2021,2500000.0,Bangalore,"TWID is shaping the future of Digital Currencies, delivering new-age fintech solutions",2020,"Amit Sharma, Amit Koshal, Rishi Batra","BEENEXT, Sequoia’s Surge"
PeakPerformer,EdTech,Early seed,2021,0.0,Bangalore,"A goal-oriented, outcome-driven platform to make leadership coaching accessible to all.",2020,"Aishwarya Goel, Gaurav Jhunjhnuwala",Antler India
MyMobiForce,Internet,Pre-series A,2021,1400000.0,Noida,"Crowdsourcing platform imparting best-in-class services with immensely talented, skilled & qualified workforce pan-India",2018,"Dheeraj Khatter, Himanshu Kumar, Kshitiz Saini",Bharat Inclusion
Pine Labs,Information Technology,Unknown,2021,600000.0,Noida,A merchant platform company that provides financing and last-mile retail transaction technology to merchants,1998,Amrish Rau,"Fidelity, BlackRock"
Genworks Health,Healthcare,Unknown,2021,2000000.0,Bangalore,GENWORKS Health is an initiative by GE for empowering healthcare professionals operating in the rural areas to deliver better medical facilities and diagnostics while keeping things affordable.,2015,S Ganeshprasad,Blacksoil
Pocketly,FinTech,Unknown,2021,0.0,Bangalore,"Pocketly provides quick cash on hand, anytime - anywhere!",2019,"Aarav Bhatia, Navdeesh Ahuja",
Neverinstall,Information Technology,Seed,2021,370000.0,Bangalore,A cloud platform to bring any GUI application regardless of OS and Device type to the browser.,2019,"Lakshmana Pasala, Ram Pasala",Speciale Invest
CoRover,Information Technology,Unknown,2021,0.0,Bangalore,CoRover is the world’s first and the highest ROI delivering human-centric conversational AI platform.,2016,"Ankush Sabharwal, Manav Gandotra, Kunal Bhakhri",Canbank Venture Capital Fund
BeatO,Healthcare,Pre-series B,2021,5000000.0,New Delhi,ULTIMATE app to manage chronic conditions.,2015,Gautam Chopra,W Health Ventures
Earth Rhythm,Cosmetics,Seed,2021,1200000.0,Gurugram,A mission to make customers healthier and Earth a little greener.,2020,Harini Sivakumar,Anicut Angel Fund
Fountain9,Computer software,Seed,2021,1900000.0,Mumbai,"Fountain9 is a Y Combinator backed company, which offers predictive inventory planning and optimization software for e-commerce, DTC and retail companies.",2019,"Niki Khokale, Rajas Lonkar","021 Capital, Y Combinator"
Rockclimber,Food & Beverages,Unknown,2021,1000000.0,Bangalore,RockClimber is a new age beverage brand with a portfolio of alcoholic and non alcoholic drinks.,2019,"Deepak Poduval, Hariprasad Shetty",Anand Prakash Sharma
SpEd@home,EdTech,Unknown,2021,300000.0,Mumbai,"Provide Remediation, Occupational Therapy, Speech Therapy and Socio-emotional coaching for children with Learning Disabilities like Dyslexia, Dysgraphia, Dyscalculia",2020,Dhaval Mody,
CanPe,Computer software,Seed,2021,0.0,Bangalore,"Digital-first debt collections platform that is driven by compassion, and powered by AI.",2019,Arindam Choudhury,Axilor Ventures
Green Soul,Consumer Goods,Unknown,2021,200000.0,Ambernath,Green Soul is No.1 brand on Amazon India in Ergonomic chairs category in terms of customer reviews.,2016,Ravi Khushwani,velocity.in
Shiprocket,Logistics,Series D1,2021,41000000.0,New Delhi,India's #1 eCommerce Logistics and Shipping Solution Empowering over 1 Lakh Indian eCommerce Sellers.,2012,"Saahil Goel, Akshay Ghulati","March Capital, Tribe Capital"
DealShare,Retail,Unknown,2021,144000000.0,Bangalore,The next generation disruptive (social) e-commerce product for the masses.,2018,"Rajat Shikhar, Vineet Rao, Sourjyendu Medda",Tiger Global
Teachmint,EdTech,Pre-series B,2021,20000000.0,Bangalore,Teachmint is an all-in-one education technology platform created specifically for the tutors of the digital age.,2020,"Mihir Gupta, Payoj Jain, Divyansh Bordia, Anshuman Kumar",Learn Capital
Vahak,Transportation,Pre-series A,2021,5000000.0,Bangalore,Building India's Largest & Most Trusted Online Transport Marketplace & Directory,2017,"Vikas Chandrawat, Karan Shaha",RTP Global
goSTOPS,Hospitality,Pre-series A,2021,1000000.0,New Delhi,goSTOPS aims to be India’s biggest and most loved backpacker hostel brand.,2014,"Pallavi Agarwal, Pankaj Parwanda","IAN, Yuj Ventures"
Codedamn,Computer software,Pre-seed,2021,0.0,New Delhi,Codedamn enables anyone to learn and practice real-world programming skills and become industry relevant through our learning paths.,2020,Mehul Mohan,Antler India
Biocraft Innovation Technology,Environmental service,Pre-seed,2021,0.0,Noida,Innovation startup developing bamboo resources of India to be used in industrial use by developing injection moulding granules,2019,"Vibha Mittal, Anubhav Mittal",JITO Angel Network
Powerplay,Construction,Unknown,2021,5200000.0,Bangalore,Powerplay helps simplify end to end Construction and Architecture project management.,2020,"Shubham Goyal, Lesh Dixit","Sequoia’s Surge, Accel Partners"
Accio Robotics,Industrial Automation,Unknown,2021,0.0,Bangalore,Accio Robotics is involved in the designing and manufacturing of state-of-the-art Robotics Automation solutions.,2020,"Tuhin Sharma, Pranav Srinivasan",Uday Sodhi
Delhivery,Logistics,Series H,2021,270000000.0,Gurugram,"Delhivery is a supply chain services company that provides transportation, warehousing, freight, and order fulfillment services.",2011,"Bhavesh Manglani, Kapil Bharati, Mohit Tandon, Sahil Barua, Suraj Saharan","Fidelity, GIC"
Avishkaar,EdTech,Pre-series A,2021,600000.0,New Delhi,India's leading Ed-Tech startup spearheading the Maker Revolution in the sub-continent,2014,"Rajeev Gaba, Tarun Bhalla",Auxano
Jobsgaar,Job discovery platform,Seed,2021,140000.0,New Delhi,India's first District level/ Hyper Local Job discovery platform,2020,Atul Pratap Singh,SucSEED Indovation Fund
Almo,D2C Fashion,Seed,2021,0.0,Gurugram,Almo is a Premium Men's essentianls wear brand focused on bringing sophisticated yet functional designs to wardrobe.,2020,Abhishek Shah,Angelist India
Breathe Well-being,HealthCare,Pre-series A,2021,1000000.0,New Delhi,Breathe Wellbeing is an interactive and personalized platform that helps organization increase employee engagement and productivity.,2015,"Aditya Kaicker, Rohan Verma","Stanford Angels and Entrepreneurs India, Anjali Bansal"
GalaxEye,SpaceTech,Pre-seed,2021,0.0,Chennai,GalaxEye enables businesses to make better Decisions & perform operations efficiently via Space Technology.,2020,"Denil Chawda, Kishan Thakkar, Pranit Mehta, Satyanarayanan Chakravarthy, Suyash Singh",Speciale Invest
Good Health Clinic,HealthCare,Unknown,2021,5000000.0,Hyderabad,Full Stack Digital Health Clinic,2021,Samarth Sindhi,Khosla Ventures
Urban Company,Home services,Series F,2021,250000000.0,New Delhi,Urban Company is an India-based company providing a marketplace for freelance labor.,2014,"Abhiraj Singh Bhal, Raghav Chandra, Varun Khaitan","Vy Capital, Wellington Management"
MYBYK,Rental,Pre-series A,2021,1000000.0,Ahmadabad,MYBYK is an app that provides premium bicycle sharing and rental service.,2014,Arjit Soni,Avon Cycles
Locus,Logistics,Series C,2021,50000000.0,Bangalore,Locus is an intelligent decision-making and automation platform for logistics.,2015,"Geet Garg, Nishith Rastogi","Blume Ventures, Exfinity Venture Partners"
Crejo.Fun,EdTech,Seed,2021,3000000.0,Bangalore,Crejo.Fun is a digital extracurricular learning platform being built with an intent to help children discover their passions and interests through creative learning.,2020,Vikas Bansal,"Matrix Partners India, 021 Capital"
Bambinos,EdTech,Seed,2021,500000.0,Bangalore,Cohort based extracurricular course for kids,2020,"Ashish Gupta, Ankit Hetamsaria","HNIs, Angels"
KreditBee,FinTech,Unknown,2021,8000000.0,Bangalore,KreditBee is a digital lending platform developed to assist young professionals with their personal finances.,2018,"Karthikeyan Krishnaswamy, Madhusudan Ekambaram, Wan Hong","NewQuest Capital Partners, Motilal Oswal Private Equity"
Spardha,EdTech,Pre-series A1,2021,400000.0,Pune,"Spardha School Of Music, Spardha Academy, Spardha Online are associated marks with Spardha Learnings Private Limited.",2016,"Saurabh Srivastav, Amrita Srivastav",Inflection Point Ventures
Onelife Nutriscience,HealthCare,Unknown,2021,0.0,Mumbai,Onelife Nutriscience is a consumer healthcare brands company.,2019,Gaurav Aggarwal,Lasons India
Flatheads,Fashion,Unknown,2021,0.0,Bangalore,Flatheads is a lifestyle brand that designs and creates shoes from India for the world. Flatheads launched India's first bamboo footwear.,2019,"Ganesh Balakrishnan, Utkarsh Biradar","Pankaj Chaddah, Srivatsan Rajan"
Fable Fintech,FinTech,Series A,2021,0.0,Mumbai,"Fable Fintech is being seed-funded by the CCAvenue Group, South East Asia’s number 1 eCommerce service provider",2015,Naushad Contractor,Paytm
Holisol,Logistics,Unknown,2021,3000000.0,New Delhi,HoliSol Logistics Is a Supply Chain Operations Company!,2009,"Manish Ahuja, Naveen Rawat, Rahul Dogar","BlackSoil, CLSA Capital Partners"
Now&Me,HealthCare,Unknown,2021,1000000.0,New Delhi,"Now&Me is a safe cocoon in the form of discussion forums, for you to let out your most intimate thoughts.",2018,"Bani Singh, Drishti Gupta","Saama, Whiteboard Capital"
Fyllo,AgriTech,Seed,2021,400000.0,Bangalore,Fyllo brings farms on palms by installing on field devices and actions on top of this data.,2019,"Sudhanshu Rai, Sumit Sheoran","Indian Angel Network, Titan Capital, Lead Angels"
Cora Health,HealthCare,Unknown,2021,0.0,Bangalore,Social Commerce Marketplace for health and wellness. Help people discover products suited to their health needs.,2020,"Shrijit Venkatesh, Snigdha Kumar",
Blaer Motors,Mobility,Unknown,2021,300000.0,Chennai,Meant to augment human power and not completely replace it,2014,Abinesh Ekambaram,The Chennai Angels
Swiflearn,EdTech,Pre-series A,2021,3000000.0,Gurugram,Swiflearn provides online tuition classes to small batches to ensure personalised learning.,2019,"Abhinav Agarwal, Anand Bakode","Venture Highway, Stellaris Venture Partners"
Cashfree,FinTech,Unknown,2021,0.0,Bangalore,Cashfree is a payments and banking technology company that enables businesses in India to collect payments online and make payouts.,2015,"Akash Sinha, Reeju Datta","State Bank of India, Y Combinator"
QuickSell,E-commerce,Pre-series A,2021,2000000.0,Mumbai,B2B Mobile Commerce Platform,2017,Deepak Bhagchandani,"Sanjay Baldwa, Ajay Jain"
Truemeds,Heathcare,Series A,2021,5000000.0,Mumbai,Truemeds is a health-tech startup.,2019,"Akshat Nayyar, Kunal Wani",InfoEdge
Candes,E-commerce,Unknown,2021,3000000.0,New Delhi,Candes is a home appliances company providing a complete range of home & kitchen electrical appliances at affordable prices.,2015,"Sandeep Aggarwal, Vipin Aggarwal","Nitin Passi, Ruchirans Jaipuria"
MediBuddy,Heathcare,Unknown,2021,3000000.0,Bangalore,"MediBuddy is a digital healthcare platform for inpatient hospitalization, outpatient services, and corporate wellness benefits.",2000,"Satish Kannan, Enbasekar","Stride Ventures, InnoVen Capital"
F5,Food & Beverages,Pre-series A,2021,300000.0,New Delhi,F5 is a foods and beverages company.,2018,"Lalit Aggarwal, Raghav Arora","Venture Catalysts, Jeevak Gupta"
Capital Float,FinTech,Unknown,2021,6000000.0,Bangalore,Capital Float is an online platform that provides working capital finance to SMEs in India.,2013,"Gaurav Hinduja, Sashank Rishyasringa","Triodos Investment Management, SAIF Partners"
IntelleWings,IT startup,Seed,2021,100000.0,Panchkula,"IntelleWings develops Sanctions & Anti-money laundering solutions with a clear, concise, and fresh perspective.",2019,Pramod Sharma,
Shyplite,Logistics,Unknown,2021,1000000.0,New Delhi,Enable E-retailers to automate their logistics and increase efficiency in shipments by providing a single window shipping platform,2016,"Nisschal Jain,  Sugam Jain, Parinay Itkan",N+1 Capital
Refyne,FinTech,Series A,2021,20000000.0,Bangalore,Refyne partners with organisations to extend on-demand Earned Wage Access (EWA) to employees.,2020,"Chitresh Sharma, Apoorv Kumar","DST Global, RTP Global"
Greenjoules,Renewable Energy,Series A,2021,4500000.0,Pune,Greenjoules is a green energy technology startup that specializes in making renewable biofuels.,2018,"R. Sethunath, V S Shridhar, V. Radhika, Viraraghavan Sankaran",Blue Ashva Capital
MentorKart,Consulting,Seed,2021,150000.0,New Delhi,MentorKart™ helps to fulfil dreams and take that big step towards success.,2018,"Ashish Khare, SK Mohanty","Amit Singal, Manish Aggarwal"
Leverage Edu,EdTech,Debt,2021,2000000.0,New Delhi,AI-enabled marketplace designed to help students with their higher education and career growth plans,2017,Akshay Chaturvedi,"Trifecta Capital Advisors, Blume Ventures"
Kale Logistics,Logistics,Series A,2021,5000000.0,Thane,Kale Logistics Solutions is a global IT solutions provider focused on providing cutting-edge technology solutions to the Logistics industry.,2010,"Amar More, Vipul Jain",Inflexor Ventures
CustomerGlu,CRM,Unknown,2021,320000.0,Bangalore,CustomerGlu is a Low code Interactive Engagement platform to improve user stickiness.,2016,"Prateek Gupta, Raman Shrivastava, Sumant US","Kumar Aakash, Amit Singhal"
Cell Propulsion,EV startup,Unknown,2021,2000000.0,Bangalore,Cell Propulsion is a fleet electrification company developing solutions for large scale electrification of commercial vehicle fleets.,2016,"Nakul Kukar, Paras Kaushal",growX ventures
Wellbeing Nutrition,HealthCare,Unknown,2021,0.0,Mumbai,Organic whole food nutrition to keep up with the pace at which we live,2019,Avnish Chhabria,Klub
Pee Safe,HealthCare,Pre-series B,2021,3000000.0,Gurugram,Redcliffe Hygiene Private Limited is India's fastest growing hygiene company.,2013,"Dheeraj Jain, Srijana Bagaria, Vikas Bagaria","Shaival Desai, Alkemi Venture Partners"
Chqbook,FinTech,Unknown,2021,1000000.0,New Delhi,"Chqbook is a fintech startup that allows customers to explore, compare, book and get personal finance products.",2017,"Mohit Goel, Rajat Kumar, Sachin Arora, Vipul Sharma","Aavishkaar Venture Capital, YWC Venture Capital"
SimpliContract,Software,Seed,2021,1800000.0,Bangalore,"SimpliContract is an Enterprise SaaS offering, focused on end to end Contract Life-cycle Management.",2020,"Guru Venkatesan, Jinaraj PG, Makesh Kumar",Kalaari Capital
Dropshop,Logistics,Pre-series A,2021,1000000.0,Bangalore,Building technology to make distribution efficient and cheaper for large and small FMCG companies,2019,"Udit Dhawan, Rohit Fernandes, Ravi Teja",Inflection Point Ventures
Jumbotail,E-commerce,Debt,2021,4000000.0,Bangalore,Jumbotail is an operator of an online marketplace that simplifies food and grocery shopping.,2015,"Ashish Jhina, Karthik Venkateswaran",Alteria Capital
BYJU'S,EdTech,Unknown,2021,350000000.0,Bangalore,BYJU'S is an educational technology company that develops personalized learning programs for K-12 students.,2011,"Byju Raveendran, Divya Gokulnath","Tiga Investments, Baron Capital"
Power Gummies,Nutrition,Unknown,2021,1000000.0,New Delhi,Power Gummies are a team of passionate givers who are dedicated to catering nutritional supplements,2018,Divij Bajaj,"Venture Catalysts, 9unicorns"
Convosight,SaaS startup,Series A,2021,9000000.0,New Delhi,A mission - to help community builders become community entrepreneurs.,2019,Tarun Dhamija,Qualgro
Junio,FinTech,Seed,2021,600000.0,New Delhi,Junio is a kids-focused digital pocket money-smart card.,2020,Ankit Gera,"Amit Lakhotia, Pravin Jadhav"
Wherehouse.io,Logistics,Seed,2021,0.0,New Delhi,"Wherehouse.io is a supply chain intelligence company, helping brands to move closer to their customers enabling faster and better deliveries and accelerating business growth.",2020,"Vaibhav Chawla, Jeevan Prakash, Lavelesh Sharma",Better Capital
Flexmoney,FinTech,Series A,2021,4800000.0,Mumbai,"Flexmoney’s mission is to address the enormous digital credit market opportunity created by the disruption from e-commerce, EMI and BNPL checkout finance",2015,Yezdi Lashkari,Pravega Ventures
